{
  "admitted_by": "HUMAN_AUTHORITY",
  "adoption_ref": {
    "adoption_id": "ADOPT_P90_R6_REBIND_PRE_RESULT_FREEZE_AND_FRESH_RUN",
    "comment_id": "5715652626",
    "comment_url": "https://github.com/manosube/manosube-agent-civilization-os/pull/90#issuecomment-5715652626"
  },
  "authorized_protocol_or_corpus_ref": {
    "protocol_freeze_id": "CBPF-7734C3D061B73E03690A7D3C11DFFCA92C831040E373E17FDC1EE8D9457E088F",
    "protocol_freeze_semantic_fingerprint": "sha256:f9638411d54c5fcd61ac85ea770674383d768abe9e30afe8ee583e6396664bca"
  },
  "ed25519_public_key": "0f183eed0aae19425e8f85c3a619b21ddc4efdb432966ab91cfdbc6dd7f2fdab",
  "generated_at": "2026-09-17T14:14:07Z",
  "key_id": "sha256:447776a9aaad1ebf2bc6936f169e494e418187fb71553086680b355a7d9f3f49",
  "project_binding_ref": {
    "id": "PB-CB21-R6-0001",
    "kind": "project_binding"
  },
  "project_id": "PRJ-CB21-R6-0001",
  "reproducer_actor_or_authority_id": "SHUKOU_PHASE21_REPRODUCER",
  "revocation_status": "ACTIVE",
  "role": "INDEPENDENT_PHASE_21_REPRODUCER",
  "schema_version": "0.1",
  "trust_anchor_id": "CBTA-F4FEBDBC9C8E7309C1855E2E59072824F812382D7B11B744483F804C483C759E",
  "trust_anchor_semantic_fingerprint": "sha256:9e84a9e5ce71859dc74a77f89a011731ddda6eae004297664f717207ae205ae0",
  "valid_from": "2026-09-17T05:05:49Z",
  "valid_until": null
}
